index,author,comment_text,comment_timestamp,likes,query,video_id,video_title,,,
0,ExoticGrundy,"its my absolute belief that you dont need shakes, or pills to get big.\ufeff",2016-08-21T05:02:46.000Z,0,meal replacement shakes,bCnE-zMOq8o,Meal Replacement Shakes Elliott Uses,,,
0,pewdiepies secret admirer,"Im sorry man but, I just have to ask are you black?\ufeff",2016-06-24T17:11:32.000Z,0,meal replacement shakes,bCnE-zMOq8o,Meal Replacement Shakes Elliott Uses,,,
0,Tagger Tag,"Try Yokebe, order it from the EU.\ufeff",2016-06-05T07:26:23.000Z,0,meal replacement shakes,bCnE-zMOq8o,Meal Replacement Shakes Elliott Uses,,,
0,I Love You C.B.,So what flavors do they have and would you say that this is better than \nHerbalife shakes? Does it get you full?\ufeff,2016-05-22T16:12:47.000Z,0,meal replacement shakes,bCnE-zMOq8o,Meal Replacement Shakes Elliott Uses,,,
0,I Love You C.B.,So what flavors do they have and would you say that this is better than \nHerbalife shakes? Does it get you full?\ufeff,2016-05-22T16:12:14.000Z,0,meal replacement shakes,bCnE-zMOq8o,Meal Replacement Shakes Elliott Uses,,,
0,Pitt Crunch,I didn't shit for two days its not a good feeling LMAO\ufeff,2016-05-19T12:47:54.000Z,1,meal replacement shakes,bCnE-zMOq8o,Meal Replacement Shakes Elliott Uses,,,
0,omar juarez,Elliot im currently on a weight loss plan . Would u recommend replacing my \ndinner with a protein shake?\ufeff,2016-03-16T00:43:33.000Z,0,meal replacement shakes,bCnE-zMOq8o,Meal Replacement Shakes Elliott Uses,,,
0,Chad Aoun,There is no conclusive scientific evidence to support the claim that MSG \ncauses headaches according to the FDA.\ufeff,2016-01-05T16:55:46.000Z,1,meal replacement shakes,bCnE-zMOq8o,Meal Replacement Shakes Elliott Uses,,,
0,Griztophe LeBaire,i absolutely refuse to believe that you're not the long-lost third hodge \ntwin.\ufeff,2015-12-31T08:42:48.000Z,26,meal replacement shakes,bCnE-zMOq8o,Meal Replacement Shakes Elliott Uses,,,
0,Anthony Rivelli,try ensure elliot. really recommend it. Going from 5-10 125lbs to 6ft \n150lbs Im loving it\ufeff,2015-12-20T19:33:46.000Z,0,meal replacement shakes,bCnE-zMOq8o,Meal Replacement Shakes Elliott Uses,,,
0,Eat.Health Lee,"Hello, my name is Lee Primeau Freelance Nutritionist at Eat.Health Lee. A \nDutch based meal replacement company, Joylent and I launched a co-operative \ncampaign The One Year Joylent Lifestyle Experiment (Google it). 1 Year, 1 \nMan Just Joylent, Our aim is to see the long term effects of consuming \nsolely meal replacement shakes. In addition we have an active indiegogo.com \ncampaign for the funding of medical testing, should be really \ninteresting... Lee\ufeff",2015-11-06T18:57:17.000Z,0,meal replacement shakes,bCnE-zMOq8o,Meal Replacement Shakes Elliott Uses,,,
0,Jorge Castro,"Bro, 2 scoops of protein (about 60 grams), 1-2 cups of oats (the NATURAL \nkind) depending on how thick you want it, 2 or 3 cups of milk and bam. Meal \nReplacement with like 700 cals and healthy. Fuck ""PaleoMeal."" lol\ufeff",2015-09-04T06:08:24.000Z,1,meal replacement shakes,bCnE-zMOq8o,Meal Replacement Shakes Elliott Uses,,,
0,Tom Yau,don't go cheap on education and food you words are fkin gold\ufeff,2015-07-30T10:00:33.000Z,11,meal replacement shakes,bCnE-zMOq8o,Meal Replacement Shakes Elliott Uses,,,
0,lunageminiz,What about Raw Fit from Garden of Life? Try researching about it and maybe \ndo a video about it. It is an amazing product!\ufeff,2015-07-28T23:28:46.000Z,1,meal replacement shakes,bCnE-zMOq8o,Meal Replacement Shakes Elliott Uses,,,
0,Gee G,I just bough a tub of living fuel super greens and tried it with water in \nmy shaker.  God almighty it tastes like horse shit.  What's the best way to \ntake this stuff?\ufeff,2015-06-25T12:16:50.000Z,2,meal replacement shakes,bCnE-zMOq8o,Meal Replacement Shakes Elliott Uses,,,
0,Anthony Principe,Yo Elliot!!! Have you found this product in bulk ? Or any like it in bulk? \nI know the benefits these pure wheys can have for your body. Please let me \nknow if you have found anything over 15-20 serving p container. Just tired \nof feeling like shit after taking a protein shake thanks man.\ufeff,2015-06-20T16:48:44.000Z,0,meal replacement shakes,bCnE-zMOq8o,Meal Replacement Shakes Elliott Uses,,,
0,shanidavis,you saved me from buying optimum health! i'm really looking for a healthy \nweight gainer supplement...how would you use this to gain weight?\ufeff,2015-06-12T20:00:27.000Z,0,meal replacement shakes,bCnE-zMOq8o,Meal Replacement Shakes Elliott Uses,,,
0,John Reuter,"Cytogainer is a good shake. For meal replacements and mass gaining \nnecessities though, I just stick with my homemade shakes: oats, peanut \nbutter, whey, and water\ufeff",2015-06-04T03:29:28.000Z,0,meal replacement shakes,bCnE-zMOq8o,Meal Replacement Shakes Elliott Uses,,,
0,Issac Walker,Yo Elliot! Can you do a review of Shakeology?\ufeff,2015-05-27T18:10:04.000Z,0,meal replacement shakes,bCnE-zMOq8o,Meal Replacement Shakes Elliott Uses,,,
0,Guido,"The key isn\xb4t not to use supplements.\n\nIf you use the right supplements, you can reach more! Just use your brain, \nnot only your body  ... and i am talking about bodyweight training ...\ufeff",2015-05-08T14:08:16.000Z,0,meal replacement shakes,bCnE-zMOq8o,Meal Replacement Shakes Elliott Uses,,,
0,little narwhale,"link ""I like drinking calories""\ufeff",2016-10-09T16:02:59.000Z,0,meal replacement shakes,GvSm4akJMUE,Best DIY Meal Replacement Shake,,,
0,Hanna Banana,You guys should make a how-to series where you guys teach us to do random \nthings\ufeff,2016-10-08T20:53:02.000Z,0,meal replacement shakes,GvSm4akJMUE,Best DIY Meal Replacement Shake,,,
0,Fruitcup94/Draw_Snap,"Lol why is every crew member cute and stylish, I want to hug them all\ufeff",2016-10-07T00:54:16.000Z,0,meal replacement shakes,GvSm4akJMUE,Best DIY Meal Replacement Shake,,,
0,isaac random,well it \noreo!!!!!!!!!!!!!!!!!!!!!!!!!!!!!!!!!!!!!!!!!!!!!!!!!!!!!!!!!!!!!!!!!!!!!!!!!!!!!!!!!!!!!!!!!!!!!!!!!!!!!!!!!!!!!!!!!!!!!!!!!!!!!!!!!!!!!!!!!!!!!!!!!!!!!!!!!!!!!!!!!!!!!!!!!!!!!!!!!!!!!!!!!!!!!!!!!!!!!!!!!!!!!!!!!!!!!!!!!!!!!!!!!!!!!!!!!!!!!!!!!!!!!!!!!!!!!!!!!!!!!!!!!!!!!!!!!!!!!!!!!!!!!!!!!!!!!!!!!!!!!!!!!!!!!!!!!!!!!!!!!!!!!!!!!!!!!!!!!!!!!!!!!!!!!!!!!!!!!!!!!!!!!!!!!!!!!!!!!!!!!!!!!!!!!!!!!!!!!!!!!!!!!!!!!!!!!!!!!!!!!!!!!!!!!!!!!!!!!!!!!!!!!!!!!!!!!!!!!!!!!!!!!!!!!!!!!!!!!!!!!!!!!!!!!!!!!!!!!!!!!!!!!!!!!!!!!!!!!!!!!!!!!!!!!!!!!!!!!!!!!!!!!!!!!!!!!!!!!!!!!!!!!!!!!!!!!!!!!!!!!!!!!!!!!!!!!!!!!!!!!!!!!!!!!!!!\ufeff,2016-10-06T17:53:38.000Z,0,meal replacement shakes,GvSm4akJMUE,Best DIY Meal Replacement Shake,,,
0,Cory Sennett,"like needs to go full lumberjack. long hair, ungroomed beard, and flannel. \nHe looks too hipster ever since he changed his hair.\ufeff",2016-10-06T02:55:44.000Z,0,meal replacement shakes,GvSm4akJMUE,Best DIY Meal Replacement Shake,,,
0,MjDirts,I like link he's cool\ufeff,2016-10-05T09:57:22.000Z,0,meal replacement shakes,GvSm4akJMUE,Best DIY Meal Replacement Shake,,,
0,Machiones,"Think of all the new viewers who heard link say he doesn't have active \nherpies and they're like. Uh, wait, what?\ufeff",2016-10-03T23:57:14.000Z,0,meal replacement shakes,GvSm4akJMUE,Best DIY Meal Replacement Shake,,,
0,TheKillerGames Tkg,almon\ufeff,2016-10-02T20:06:38.000Z,0,meal replacement shakes,GvSm4akJMUE,Best DIY Meal Replacement Shake,,,
0,Jelena Fuller,That shake looks like the purple glop from The Cat in the Hat\ufeff,2016-10-02T16:33:52.000Z,0,meal replacement shakes,GvSm4akJMUE,Best DIY Meal Replacement Shake,,,
0,Cyanist Anthony,The force is strong with this kiwi!\ufeff,2016-10-02T01:58:33.000Z,0,meal replacement shakes,GvSm4akJMUE,Best DIY Meal Replacement Shake,,,
0,Cyanist Anthony,Feedback\ufeff,2016-10-02T01:48:28.000Z,0,meal replacement shakes,GvSm4akJMUE,Best DIY Meal Replacement Shake,,,
0,lgthrill763,"I did the same thing with an avocado like two days ago! I went to show my \ngirlfriend the knife trick to take out the pit... definitely dropped the \navocado... I don't think it works unless they are ripe, my working \nhypothesis.\ufeff",2016-10-01T07:37:26.000Z,0,meal replacement shakes,GvSm4akJMUE,Best DIY Meal Replacement Shake,,,
0,bbarrera86,every mexican knows how to take all that avocado out of the peel\ufeff,2016-09-30T23:00:48.000Z,0,meal replacement shakes,GvSm4akJMUE,Best DIY Meal Replacement Shake,,,
0,KARIN JUGOVAC,Bruscky and the dabbing sloths....now imagine a dabbing \nsloth\U0001f602\U0001f602\U0001f602\U0001f602\U0001f602\U0001f602\U0001f602\U0001f602\U0001f602\U0001f602\U0001f602\U0001f602\ufeff,2016-09-30T14:11:36.000Z,0,meal replacement shakes,GvSm4akJMUE,Best DIY Meal Replacement Shake,,,
0,RedHawk Gamer,Blender 101 for a few minutes lol\ufeff,2016-09-30T06:56:29.000Z,0,meal replacement shakes,GvSm4akJMUE,Best DIY Meal Replacement Shake,,,
0,PyroFluxation,I am a Kiwi (New Zealander) and i take offence that you are putting my kind \nin blenders. They're called 'Kiwi Fruit' here. :P\ufeff,2016-09-29T23:39:35.000Z,0,meal replacement shakes,GvSm4akJMUE,Best DIY Meal Replacement Shake,,,
0,EASYTIGER10,Is a smoothie made with milk technically a milkshake?\ufeff,2016-09-29T22:42:13.000Z,0,meal replacement shakes,GvSm4akJMUE,Best DIY Meal Replacement Shake,,,
0,SuperFeline1,avocados have 4 grams of protein and spinach has peptides which are blood \npressure reducing proteins.\ufeff,2016-09-29T19:00:55.000Z,0,meal replacement shakes,GvSm4akJMUE,Best DIY Meal Replacement Shake,,,
0,Bonnie Hundley,"Green Jello is a superfood. Yes, it's equivalent to the kiwi.\ufeff",2016-09-29T13:36:58.000Z,0,meal replacement shakes,GvSm4akJMUE,Best DIY Meal Replacement Shake,,,
0,Nina Firstavina,"Try condensed milk with durian (riped fruit, exclude the nut), it might \nsmell strong, but delicious.. We love it. :)\ufeff",2016-09-29T03:49:21.000Z,0,meal replacement shakes,GvSm4akJMUE,Best DIY Meal Replacement Shake,,,
0,Jaime Armenta,What's a really good meal replacement you would recommend?\ufeff,2016-05-27T02:08:54.000Z,0,meal replacement shakes,Sk90sy6Qm0M,Protein Shakes vs Meal Replacement Shakes,,,
0,dejonal,Excellent information; this video cleared my confusion.\ufeff,2015-10-24T12:28:29.000Z,0,meal replacement shakes,Sk90sy6Qm0M,Protein Shakes vs Meal Replacement Shakes,,,
0,MsHelloWorldtv,great info\ufeff,2015-05-13T02:40:55.000Z,0,meal replacement shakes,Sk90sy6Qm0M,Protein Shakes vs Meal Replacement Shakes,,,
0,yoursola,"Instead of a protein shake (which can be costly) for your protein, just \ndrink milk. The best source of protein in the world is an egg, next..... \nMILK!! It is easier to prepare also:)\ufeff",2015-03-22T14:59:17.000Z,0,meal replacement shakes,Sk90sy6Qm0M,Protein Shakes vs Meal Replacement Shakes,,,
0,Vegan Mermaid,Thank you! This was very informative! \ufeff,2014-11-14T03:20:00.000Z,0,meal replacement shakes,Sk90sy6Qm0M,Protein Shakes vs Meal Replacement Shakes,,,
0,TheGabydu7,"heyy, did ur parents are okay with u doin this??\ufeff",2016-08-17T02:41:08.000Z,0,meal replacement shakes,D7YUXH_bv40,Review: Women's Best Meal Replacement Shake,,,
0,Twinkle N,hii I am twinkle from india I love this product but I have no idea to order \nthis product pkz help me\ufeff,2016-08-04T13:26:21.000Z,0,meal replacement shakes,D7YUXH_bv40,Review: Women's Best Meal Replacement Shake,,,
0,Melissa Figueroa,Is it chaulky\ufeff,2016-07-21T17:37:13.000Z,0,meal replacement shakes,D7YUXH_bv40,Review: Women's Best Meal Replacement Shake,,,
0,Melissa Figueroa,Is the shake thick in texture\ufeff,2016-07-21T17:36:45.000Z,0,meal replacement shakes,D7YUXH_bv40,Review: Women's Best Meal Replacement Shake,,,
0,Melissa Figueroa,Is the shake this k\ufeff,2016-07-21T17:36:31.000Z,0,meal replacement shakes,D7YUXH_bv40,Review: Women's Best Meal Replacement Shake,,,
0,Rebekah Cox,How much sodium is in one shake?\ufeff,2016-05-16T02:04:39.000Z,0,meal replacement shakes,D7YUXH_bv40,Review: Women's Best Meal Replacement Shake,,,
0,live42dayk1,cookies and cream is nasty and chalky. I will try to drink it but something \nis weird. All these reviews said it taste amazing. Something seems fake.\ufeff,2016-05-12T14:37:28.000Z,2,meal replacement shakes,D7YUXH_bv40,Review: Women's Best Meal Replacement Shake,,,
0,mirka lust,Womens Best is sooo delicious! i love it !\ufeff,2016-05-03T15:57:08.000Z,0,meal replacement shakes,D7YUXH_bv40,Review: Women's Best Meal Replacement Shake,,,
0,Mina M,I ordered Cookies & Cream and it's not good at all. \nAfter I shake it it tastes like water with sand in it... \nNot like a shake at all /:\nBut it's working \U0001f44d\U0001f3fb\ufeff,2016-04-21T14:48:56.000Z,1,meal replacement shakes,D7YUXH_bv40,Review: Women's Best Meal Replacement Shake,,,
0,Zuri Espinosa,what was the code u used\ufeff,2016-04-20T07:18:39.000Z,0,meal replacement shakes,D7YUXH_bv40,Review: Women's Best Meal Replacement Shake,,,
0,ECON,What do you put in your face? I like your skin!!\ufeff,2016-04-16T04:14:41.000Z,0,meal replacement shakes,D7YUXH_bv40,Review: Women's Best Meal Replacement Shake,,,
0,Lili Noor,Hello hun which website u order?\ufeff,2016-04-15T20:28:26.000Z,0,meal replacement shakes,D7YUXH_bv40,Review: Women's Best Meal Replacement Shake,,,
0,maria guadalupe cazares mendoza,ola\ufeff,2016-04-14T02:31:37.000Z,0,meal replacement shakes,D7YUXH_bv40,Review: Women's Best Meal Replacement Shake,,,
0,maria guadalupe cazares mendoza,ola\ufeff,2016-04-14T02:31:35.000Z,0,meal replacement shakes,D7YUXH_bv40,Review: Women's Best Meal Replacement Shake,,,
0,maria guadalupe cazares mendoza,ola linda me gustar\xeda sabes. como puedo conseguir los productos pero plis \npodr\xedas traducir en espa\xf1ol gracias traducir en espa\xf1ol gracias. linda\U0001f60a\U0001f44d.\ufeff,2016-04-14T02:31:06.000Z,0,meal replacement shakes,D7YUXH_bv40,Review: Women's Best Meal Replacement Shake,,,
0,maria guadalupe cazares mendoza,ola linda me gustar\xeda sabes. como puedo conseguir los productos pero plis \npodr\xedas traducir en espa\xf1ol gracias traducir en espa\xf1ol gracias. linda\U0001f60a\U0001f44d.\ufeff,2016-04-14T02:30:58.000Z,0,meal replacement shakes,D7YUXH_bv40,Review: Women's Best Meal Replacement Shake,,,
0,maria guadalupe cazares mendoza,ola linda me gustar\xeda sabes. como puedo conseguir los productos pero plis \npodr\xedas traducir en espa\xf1ol gracias. linda\U0001f60a\U0001f44d.\ufeff,2016-04-14T02:30:43.000Z,0,meal replacement shakes,D7YUXH_bv40,Review: Women's Best Meal Replacement Shake,,,
0,maria guadalupe cazares mendoza,ola linda me gustar\xeda sabes. como puedo conseguir los productos pero plis \npodr\xedas traducir en espa\xf1ol gracias. linda\U0001f60a\U0001f44d.\ufeff,2016-04-14T02:30:29.000Z,0,meal replacement shakes,D7YUXH_bv40,Review: Women's Best Meal Replacement Shake,,,
0,maria guadalupe cazares mendoza,ola linda me gustar\xeda sabes. como puedo conseguir los productos pero plis \npodr\xedas traducir en espa\xf1ol gracias. linda\U0001f60a\U0001f44d\ufeff,2016-04-14T02:30:15.000Z,0,meal replacement shakes,D7YUXH_bv40,Review: Women's Best Meal Replacement Shake,,,
0,Gurmeet singh,"Hey brandon, new sub, great video man \nI was just gonna ask you, can you checkout nutrisport mrp 60 30, and let me \nknow what you think I was gonna give it go \n\nthanks\ufeff",2016-05-18T22:18:21.000Z,0,meal replacement shakes,RKRavqmEOW8,Meal Replacement Shakes?,,,
0,faizan Ali,What is the size of your t shirt man?\ufeff,2016-05-09T04:12:16.000Z,0,meal replacement shakes,RKRavqmEOW8,Meal Replacement Shakes?,,,
0,Back up Account,"I'm using nutrisport 90+ whey protein in shakes as a meal suppliment, and \nalthough ive lost alot of weight, and feel alot better, i wonder if just \nhaving these shakes is good for me in the long run?\ufeff",2016-02-29T22:46:18.000Z,0,meal replacement shakes,RKRavqmEOW8,Meal Replacement Shakes?,,,
0,Emily Lockwood,i bought yesterday wellnes shake...so there is for about 20 days. My \nquestion is : Am i going to have yo-yo effect if i stop drinking that shake \nafter 20 days ?\ufeff,2015-10-04T17:32:43.000Z,0,meal replacement shakes,RKRavqmEOW8,Meal Replacement Shakes?,,,
0,r Negoro,"We're just lazy to count the cals , however a few glasses of milk, oatmeal \nand fish oil can save the day.\ufeff",2015-09-24T15:30:33.000Z,0,meal replacement shakes,RKRavqmEOW8,Meal Replacement Shakes?,,,
0,fran t,do you have an opinions on idealshake?\ufeff,2015-07-25T01:28:19.000Z,1,meal replacement shakes,RKRavqmEOW8,Meal Replacement Shakes?,,,
0,jazmin ramos,I use the total soy meal replacement shake it keeps me full for almost 3 or \n5 hours I add banana and ice cubs with soy milk \ufeff,2015-02-15T21:47:59.000Z,0,meal replacement shakes,RKRavqmEOW8,Meal Replacement Shakes?,,,
0,Mariannexbx,"ive started Shake that weight, meal replacement shakes, im uploading vlogs \n:-) \ufeff",2014-11-17T19:54:57.000Z,0,meal replacement shakes,RKRavqmEOW8,Meal Replacement Shakes?,,,
0,royaldestiny,You're cute\ufeff,2014-03-03T15:45:05.000Z,2,meal replacement shakes,RKRavqmEOW8,Meal Replacement Shakes?,,,
0,Brandon Campbell,Thanks!\ufeff,2013-09-28T16:05:10.000Z,0,meal replacement shakes,RKRavqmEOW8,Meal Replacement Shakes?,,,
0,Brandon Campbell,"If you used a calculator to come up with your intake, then it already takes \ninto account your activity, level, just something to think about!\ufeff",2013-09-28T16:05:03.000Z,0,meal replacement shakes,RKRavqmEOW8,Meal Replacement Shakes?,,,
0,Rafael Seher,And by the way you have a very helpful channel. Keep up the good work \nbrother\ufeff,2013-09-28T00:00:19.000Z,0,meal replacement shakes,RKRavqmEOW8,Meal Replacement Shakes?,,,
0,Rafael Seher,I track my calorie intake daily including the calories lost during my \nworkouts\ufeff,2013-09-27T23:52:57.000Z,0,meal replacement shakes,RKRavqmEOW8,Meal Replacement Shakes?,,,
0,Brandon Campbell,"This is why I like tracking calories, you might be putting yourself into a \nbig deficit really quickly, which could explain some of the hunger pains. \ufeff",2013-09-27T23:00:32.000Z,0,meal replacement shakes,RKRavqmEOW8,Meal Replacement Shakes?,,,
0,Rafael Seher,... Or if there is another alternative to my snacking\ufeff,2013-09-27T22:34:53.000Z,0,meal replacement shakes,RKRavqmEOW8,Meal Replacement Shakes?,,,
0,Rafael Seher,"I find myself exercising at least 5 times a week for an hour each session \ndoing cardio because I want to lose the belly fat. It's been working and \nlost about 30 pounds already since I began, but the only issue I have us I \nkeep getting hungry, even though I don't eat that much during lunch, which \nmainly includes vegetables, meat and olive oil most of the time, I find \nmyself snacking a lot. Now I don't know whether by taking these meal \nreplacement meals if that would help me reduce my snacks...\ufeff",2013-09-27T22:34:29.000Z,0,meal replacement shakes,RKRavqmEOW8,Meal Replacement Shakes?,,,
0,Brandon Campbell,Thanks man!\ufeff,2013-03-10T18:02:28.000Z,0,meal replacement shakes,RKRavqmEOW8,Meal Replacement Shakes?,,,
0,JamesZeroSix,"Dude, just found your channel, awesome videos. Great topics and \ninformation, and the cadence and duration are spot on.\ufeff",2013-03-10T15:56:45.000Z,0,meal replacement shakes,RKRavqmEOW8,Meal Replacement Shakes?,,,
0,Brandon Campbell,"Agreed, I suggest the same!\ufeff",2012-12-08T19:07:02.000Z,0,meal replacement shakes,RKRavqmEOW8,Meal Replacement Shakes?,,,
0,MrMikkiFunk,"I always think meal replacement shakes are such a silly thing to market, \npersonally. If you really want something drinkable that is meal-size in \nterms of macros and calories, its easy to make your own. I make mine \npre-workout, more of a smoothie really and basically a liquidized \nbreakfast! But does the job :) Like you said, at least you know exactly \nwhat macros are going into it, how much calories there are, and what each \ningredient is doing :)\ufeff",2012-12-08T12:38:18.000Z,0,meal replacement shakes,RKRavqmEOW8,Meal Replacement Shakes?,,,
0,amit boy,can i take meal replacement before cardio?\ufeff,2016-05-05T09:50:44.000Z,0,meal replacement shakes,ItAzcnljcqU,Homemade Protein Meal Replacement Shake,,,
0,Hiep Chau,"Hello, Brandon. If I make this meal replacement shake and bring it to \nschool with me, will it be still drinkable after 4 hours? How long will it \ntake to make the homemade meal replacement spoiled? What can I do to make \nit last longer?\ufeff",2016-04-03T08:04:41.000Z,0,meal replacement shakes,ItAzcnljcqU,Homemade Protein Meal Replacement Shake,,,
0,GhostTech,can this help me gain weight if I'm having a hard time tracing calories ?\ufeff,2015-12-15T04:40:52.000Z,0,meal replacement shakes,ItAzcnljcqU,Homemade Protein Meal Replacement Shake,,,
0,Patty Cabanillas,I need a meal replacement shake to loose weight not gain. Looks good \nthough!!\ufeff,2015-10-02T05:24:52.000Z,1,meal replacement shakes,ItAzcnljcqU,Homemade Protein Meal Replacement Shake,,,
0,Cartoon Coyote,Can I cheat and just have 2 of these a day and nothing else to lose weight \nand getting macros through multivitamins? Maybe divide it into 4 shakes. Is \nthis too unhealthy?\ufeff,2015-09-27T04:29:50.000Z,0,meal replacement shakes,ItAzcnljcqU,Homemade Protein Meal Replacement Shake,,,
0,jack sparrow,Ten pound about 149 serving\ufeff,2015-08-30T03:38:04.000Z,0,meal replacement shakes,ItAzcnljcqU,Homemade Protein Meal Replacement Shake,,,
0,griffin winn,what could u do instead of whey i cant afford that ??? something similar\ufeff,2015-08-08T00:37:09.000Z,0,meal replacement shakes,ItAzcnljcqU,Homemade Protein Meal Replacement Shake,,,
0,griffin winn,Honey is good as well \ufeff,2015-06-29T20:12:57.000Z,1,meal replacement shakes,ItAzcnljcqU,Homemade Protein Meal Replacement Shake,,,
0,miguel martinez,What do you think about using a protein blend?\ufeff,2015-04-07T03:04:41.000Z,0,meal replacement shakes,ItAzcnljcqU,Homemade Protein Meal Replacement Shake,,,
0,beatsbyz,Is syntha 6 good for a meal replacement ? I weigh 135 and am looking to put \non weight but healthy weight and I don't eat 3x a day like your supposed to \n\ufeff,2015-03-17T00:13:08.000Z,0,meal replacement shakes,ItAzcnljcqU,Homemade Protein Meal Replacement Shake,,,
0,fullmetalcontactzen,"This is good , very good actually pretty damn good, good , men ,good.\ufeff",2015-01-19T20:54:01.000Z,0,meal replacement shakes,ItAzcnljcqU,Homemade Protein Meal Replacement Shake,,,
0,Christian Acosta,is it bad if I make this everyday? since I'm not a morning person and I \ndon't like eating breakfast i'm thinking of substituting this instead\ufeff,2014-12-05T03:42:17.000Z,0,meal replacement shakes,ItAzcnljcqU,Homemade Protein Meal Replacement Shake,,,
0,relishxylitol,"Hello Brandon, thank you so much for your video. Actually I feel like my \nbody is not used to whey protein: every time after I drink whey protein \nshake, I feel it does not digest very well in my stomach. The symptom is \nbad digestion and a lot of farts.   The protein I am having now is this \none: \nhttp://www.amazon.com/PlantFusion-Protein-Vanilla-Bean-2lb/dp/B0021FEMZG/ref=sr_1_1?ie=UTF8&qid=1416885694&sr=8-1&keywords=plant+fusion. \n  Do you know what happens? Does it mean I cannot drink anymore protein?\ufeff",2014-11-25T03:23:53.000Z,0,meal replacement shakes,ItAzcnljcqU,Homemade Protein Meal Replacement Shake,,,
0,James Macario,@CristianGuzmanFitness\n\ufeff,2014-07-07T05:40:09.000Z,0,meal replacement shakes,ItAzcnljcqU,Homemade Protein Meal Replacement Shake,,,
0,Rob Mckenzie,"sounded a bit like patrick bateman (american physco) when you said ""i like \nto live dangerously close to the edge""\ufeff",2014-03-18T01:38:00.000Z,0,meal replacement shakes,ItAzcnljcqU,Homemade Protein Meal Replacement Shake,,,
0,Odell Griffin Jr,How much is 1 cup of oats in grams?\ufeff,2014-03-09T21:51:35.000Z,0,meal replacement shakes,ItAzcnljcqU,Homemade Protein Meal Replacement Shake,,,
0,Ricard Charles,Thx do u have a instagram its the same username as my kik even tho I know u \ndont have a kik\n\ufeff,2014-03-07T03:41:38.000Z,0,meal replacement shakes,ItAzcnljcqU,Homemade Protein Meal Replacement Shake,,,
0,R0N2,"Hey man, I'm bulking with white rice as my primary source for carbs...yay \nor nay?\ufeff",2014-03-06T00:53:21.000Z,0,meal replacement shakes,ItAzcnljcqU,Homemade Protein Meal Replacement Shake,,,
0,Baptiste VT,"Thanks you for this tips, i will try it because at school someday i don't \nhave time to cook ! \ufeff",2014-03-05T18:13:41.000Z,1,meal replacement shakes,ItAzcnljcqU,Homemade Protein Meal Replacement Shake,,,
0,Aidan Talisker,What do you look for in a protein powder and how do you cut through the \nmarketing BS of many protein powders?  Thanks.\ufeff,2014-03-05T17:06:42.000Z,0,meal replacement shakes,ItAzcnljcqU,Homemade Protein Meal Replacement Shake,,,
0,Felicity Ross,"A good friend of mine applied this perfect diet plan, ""fizy unique plan"" \n(Google it). The result was amazing; she lost 10 pounds. I just googled it \nimmediately and also I`m also using this awesome diet.\ufeff",2016-09-23T17:21:36.000Z,1,meal replacement shakes,wfWyNItGcRo,EASY High Protein Smoothie: Meal Replacement,,,
0,ehdbe jdbev,nice tip.. i make my shakes on daily basis which consists of oats but i \ngrind the Oats to powder and then pour it to the blender.. drinking the oat \npowder in shake is easier them the actual oats itself.. hope tht helps \U0001f644\ufeff,2016-09-13T20:15:36.000Z,1,meal replacement shakes,wfWyNItGcRo,EASY High Protein Smoothie: Meal Replacement,,,
0,schwantz037,As soon as cholesterol and low fat popped up I clicked off. #outofdate\ufeff,2016-09-10T19:19:45.000Z,2,meal replacement shakes,wfWyNItGcRo,EASY High Protein Smoothie: Meal Replacement,,,
0,radhita intan,When do you drink this? Is it pre workout or post workout?\ufeff,2016-09-01T07:35:05.000Z,0,meal replacement shakes,wfWyNItGcRo,EASY High Protein Smoothie: Meal Replacement,,,
