index,author,comment_text,comment_timestamp,likes,query,video_id,video_title,,,
0,EverydayMommy,You look great and even better you feel great!! Congrats on those guns \U0001f4aa \ufeff,2015-03-07T04:33:47.000Z,0,vega one shake,TGu8Jf-5pfE,FITNESS UPDATE: I LOST 10LBS | AmandaMuse,,,
0,Lindsay Smith,what are the ingredients?\ufeff,2016-11-07T22:46:25.000Z,0,vega one shake,2jc8i2LgpJM,Vega One Protein Frappe,,,
0,Randy Cruz,good one!\ufeff,2015-09-08T19:30:50.000Z,0,vega one shake,2jc8i2LgpJM,Vega One Protein Frappe,,,
0,ryan g,"dude in the black shirt looks like a meat in the closet, i bet he goes home \nevery night and orders 4 big mac meals, super sized fries, 3 large coca \ncolas, and 2 extra large orange pops\ufeff",2016-10-14T23:08:56.000Z,0,vega one shake,jTTFqEGq83Q,Vega One Review in Depth,,,
0,rocknsoul13,chocolate one has hazelnut people watch out i bout s big want just to throw \naway\n\nvanilla good\ufeff,2016-04-15T05:58:24.000Z,0,vega one shake,jTTFqEGq83Q,Vega One Review in Depth,,,
0,MissCoopette,#NAME?,2016-03-28T20:40:38.000Z,0,vega one shake,jTTFqEGq83Q,Vega One Review in Depth,,,
0,lars ulrich,"""In Depth"" and you didn't try it. smh\ufeff",2016-02-14T04:27:31.000Z,0,vega one shake,jTTFqEGq83Q,Vega One Review in Depth,,,
0,Xaviier,Okay so I just purchased the coconut and almond flavour of vega all in one \nnutritional shake... I did what the back directions mentioned which is 1 \nscoop with water in a cup then mix... so I did that with a spoon...THE \nRESULTS: THE MIXTURE TURNED OUT HORRIBLE.. POWDERY TASTING...especially \ngoing down the throat..ewwww \n\nPlan B: mixed in blended same shit..\n\nSo help a brother out... how can I get rid of the after taste powery taste. \nThank you :-)\ufeff,2015-08-28T22:18:19.000Z,0,vega one shake,jTTFqEGq83Q,Vega One Review in Depth,,,
0,tuberoses1,Thank you for taking the time and explaining this.\ufeff,2015-07-28T21:00:29.000Z,0,vega one shake,jTTFqEGq83Q,Vega One Review in Depth,,,
0,TuAmigoElMorrocoy,"I made a shake using Vega one the other day and it was so absolutely \ndisgusting that I found it undriklable, half of my shake went down the \ndrain... and I HATE wasting food\n\nAnd Im currently drinking another shake, with another type of Vegan \nprotein... not as gross as Vega One but still gross.... is there any Vegan \nprotein powder that doesn't taste like a mix of stevia and flour? my \ntastebuds hurt T_T\ufeff",2015-07-16T19:35:59.000Z,0,vega one shake,jTTFqEGq83Q,Vega One Review in Depth,,,
0,CAWDBOAWD,how can you review a product without having thoroughly tested it / even \ntasted it?\ufeff,2015-06-21T03:40:29.000Z,0,vega one shake,jTTFqEGq83Q,Vega One Review in Depth,,,
0,WhatThatify,strange you don't even taste it. Reading the label isn't very helpful but \nyour anecdotal notes was more of interest than the product. It would be a \ngood thing to say just how much more you are paying for.\ufeff,2015-05-21T06:32:48.000Z,0,vega one shake,jTTFqEGq83Q,Vega One Review in Depth,,,
0,Darlene Juarez,I purchased this as a meal replacement in hopes to lose weight. Haven't \nstarted it yet. I was wondering if you guys had any advice. Thanks in \nadvance \ufeff,2015-03-19T18:23:14.000Z,0,vega one shake,jTTFqEGq83Q,Vega One Review in Depth,,,
0,Erick Tavares,"but when yo usay there is 15g of protein, you don't say in a serving of how \nmuch????? plz tell me it is 15 g of protein in how much of g powder? \ufeff",2015-01-17T20:13:58.000Z,0,vega one shake,jTTFqEGq83Q,Vega One Review in Depth,,,
0,fr00bers,this chubby bastard talkin bout nutrition\ufeff,2014-12-27T22:25:14.000Z,2,vega one shake,jTTFqEGq83Q,Vega One Review in Depth,,,
0,traceurjay,"This might be a silly question, but what's the possibility of popping \npositive on a drug test with the hemp seed protein in the nutritional \nshake?\ufeff",2014-10-15T01:30:30.000Z,0,vega one shake,jTTFqEGq83Q,Vega One Review in Depth,,,
0,Amanda Aube,"This is really informational. I have horrible stomach allergies, dairy, \ngluten, soy, starch, unnatural sugar. So far this is the only protein \npowder I have found that shouldn't upset my stomach. Thank you all so much.\ufeff",2014-08-25T16:16:15.000Z,2,vega one shake,jTTFqEGq83Q,Vega One Review in Depth,,,
0,Ssam,"why do they always have to put stevia, sucralose, splenda, aspartame, \netc.!?\ufeff",2014-07-15T16:37:01.000Z,0,vega one shake,jTTFqEGq83Q,Vega One Review in Depth,,,
0,John Rue,looks like these guys were forced to do the reviews after hours without any \npromise of getting paid (overtime). \ufeff,2014-04-24T01:29:26.000Z,2,vega one shake,jTTFqEGq83Q,Vega One Review in Depth,,,
0,BestPriceNutrition.com,Using a star system is difficult as a given product may get 5 stars in \nterms of one thing and 3 in another area so it kind of takes away from the \nscience. We are making more of an effort to give a bit more of an overview \nin so far as a rating etc... Thank you for feedback and watching. \ufeff,2013-10-18T14:38:23.000Z,0,vega one shake,jTTFqEGq83Q,Vega One Review in Depth,,,
0,TheGlobuleReturns,"My poor, poor left ear ;(\ufeff",2013-10-18T13:50:16.000Z,0,vega one shake,jTTFqEGq83Q,Vega One Review in Depth,,,
0,j swano,"hi guys love the videos, you two are very knowledgable.. Just a suggestion, \nhave you ever considered adding a rating to each product review you do? \nlike a 1,2,3,4 or 5 out of 5 rating? \ufeff",2013-10-18T06:03:28.000Z,0,vega one shake,jTTFqEGq83Q,Vega One Review in Depth,,,
0,Amino Wellness,"I love using my Vega One powder i mix it with coconut water, fruits and \nsome greens freak. Its delish. I don't hate shakeology but don't like that \nits part of a multi level marketing project.\ufeff",2016-08-16T06:32:21.000Z,0,vega one shake,bQRbeHQjSBo,Shakeology (vegan) Meal Replacement vs. Vega One Shake,,,
0,Ferry Y,omg she's such a beauty :O\ufeff,2016-07-29T23:27:15.000Z,0,vega one shake,bQRbeHQjSBo,Shakeology (vegan) Meal Replacement vs. Vega One Shake,,,
0,Sophie Somerfeldt,"What a breath of fresh air! I have watched well over a dozen video \n""reviews"" on Skakeology and Shakeology replacements--yours is absolutely \nthe first neutral, intelligent and informative one I have seen. I will \ncheck out your other videos!\ufeff",2016-04-23T14:02:55.000Z,0,vega one shake,bQRbeHQjSBo,Shakeology (vegan) Meal Replacement vs. Vega One Shake,,,
0,Rhiannon Gardier,Thank you for this! So happy I found your review!\ufeff,2016-03-18T01:42:51.000Z,1,vega one shake,bQRbeHQjSBo,Shakeology (vegan) Meal Replacement vs. Vega One Shake,,,
0,Syanayde Phoenixfire,"Thank you for an honest, unbiased opinion!!! It's appreciated :) I have \nbeen thinking of switching from Shakeology to Vega one because Shakeology \nis just not in my budget anymore. Sometimes I just want to have a shake in \nthe morning since it's such a quick breakfast (with a little added fruit \nand spinach). It's nice to see that I won't be making a huge sacrifice in \nquality by switching :)\ufeff",2015-10-14T23:31:03.000Z,0,vega one shake,bQRbeHQjSBo,Shakeology (vegan) Meal Replacement vs. Vega One Shake,,,
0,durian74,Vega One and Vega Sports is my option. \U0001f44d\U0001f3fc\ufeff,2015-09-22T13:09:37.000Z,1,vega one shake,bQRbeHQjSBo,Shakeology (vegan) Meal Replacement vs. Vega One Shake,,,
0,Ray Ramirez,"i want to thank you very much!!!! i dont drink shakes but, I accidentally \nsome how wond up seeing your video and you mentioned MSM so i decided to \nbuy it as supplement to take. i have had lots of pain from arthritis caused \nby the aggressive ulcerative colitis ive had for more than 10yrs. i have \ntaken MSM for 3 weeks now and i feel amazing!!!! god bless you and thank \nyou from the bottom of my heart\ufeff",2015-09-03T01:57:42.000Z,0,vega one shake,bQRbeHQjSBo,Shakeology (vegan) Meal Replacement vs. Vega One Shake,,,
0,jayelit,Ur cute\ufeff,2015-08-31T21:17:35.000Z,0,vega one shake,bQRbeHQjSBo,Shakeology (vegan) Meal Replacement vs. Vega One Shake,,,
0,Pamela Schmidlin (the Dog Runner),"Beautiful review and info, if your anywhere in the NY area or east coast \nI'd love to do a video with you!\ufeff",2015-08-21T14:10:26.000Z,0,vega one shake,bQRbeHQjSBo,Shakeology (vegan) Meal Replacement vs. Vega One Shake,,,
0,Monica carroccio,the vitamins don't compare to shakeology -- You'd have to drink two shakes \na day to the one shake you need with shakeology to get the same amount of \nvitamins and minerals needed for day  therefore your price will be bumped \nup!  And who wants to drink 2 shakes a day if you DON'T have to!\ufeff,2015-06-12T13:45:06.000Z,2,vega one shake,bQRbeHQjSBo,Shakeology (vegan) Meal Replacement vs. Vega One Shake,,,
0,lulu_bee,This was perfect and really answered my questions as to what is a good \nsubstitute for shakeology. You are very informative and I just love it! \nThank you so much for this video!!!! Shakeology is great but I am just not \nwilling to spend 130$ or even 100$ a month on it. Vega one seems to be a \ngood alternative. I\u2019m going to give it a try. Thanks again!! =)\ufeff,2015-03-25T12:17:39.000Z,0,vega one shake,bQRbeHQjSBo,Shakeology (vegan) Meal Replacement vs. Vega One Shake,,,
0,karin collado,we all know we all prefer shakeology......theyre just so damn expensive! i \nwouldnt spend more than $60 on it\ufeff,2015-03-20T03:29:16.000Z,2,vega one shake,bQRbeHQjSBo,Shakeology (vegan) Meal Replacement vs. Vega One Shake,,,
0,Laura Lemonade,"thanks, best review i've seen so far! \ufeff",2015-03-16T20:13:38.000Z,0,vega one shake,bQRbeHQjSBo,Shakeology (vegan) Meal Replacement vs. Vega One Shake,,,
0,Nathan J Wells,What are your thoughts on faba beans and lentils as quality protein sources \nfor vegans?\ufeff,2015-02-26T01:05:50.000Z,0,vega one shake,bQRbeHQjSBo,Shakeology (vegan) Meal Replacement vs. Vega One Shake,,,
0,becky corr,thankyou!!\ufeff,2015-02-15T00:25:13.000Z,0,vega one shake,bQRbeHQjSBo,Shakeology (vegan) Meal Replacement vs. Vega One Shake,,,
0,SraiTdenI,Since ancient times\ufeff,2015-02-07T06:28:34.000Z,0,vega one shake,bQRbeHQjSBo,Shakeology (vegan) Meal Replacement vs. Vega One Shake,,,
0,SraiTdenI,Feeling sore is 100% natural.\ufeff,2015-02-07T06:28:23.000Z,0,vega one shake,bQRbeHQjSBo,Shakeology (vegan) Meal Replacement vs. Vega One Shake,,,
0,Anee Angel,Can you try arbonne shakes?\ufeff,2015-01-15T17:43:44.000Z,0,vega one shake,bQRbeHQjSBo,Shakeology (vegan) Meal Replacement vs. Vega One Shake,,,
0,Cartoon Artisan,"Thanks for this comparison, I was wondering about these two shakes and what \nthe differences are. You are so pretty!\ufeff",2014-12-22T08:51:25.000Z,1,vega one shake,bQRbeHQjSBo,Shakeology (vegan) Meal Replacement vs. Vega One Shake,,,
0,Annel Ochoa,Can I take this after I'm done working out to help with weight loss?\ufeff,2016-09-12T01:29:08.000Z,0,vega one shake,tCOmVQVmC-M,Review: VEGA Nuritional Shake | JustEnufFitness,,,
0,Indzzgracey,fruit and chocolate is awesome\ufeff,2016-04-01T02:36:33.000Z,0,vega one shake,tCOmVQVmC-M,Review: VEGA Nuritional Shake | JustEnufFitness,,,
0,More than a conqueror,The vanilla flavor tastes good with almond milk :)\ufeff,2016-02-28T13:12:03.000Z,0,vega one shake,tCOmVQVmC-M,Review: VEGA Nuritional Shake | JustEnufFitness,,,
0,Anonymous 780,You're pretty haha.. but I also like the product.. just trying to find \nrecipes on it :p\ufeff,2015-11-12T02:50:35.000Z,0,vega one shake,tCOmVQVmC-M,Review: VEGA Nuritional Shake | JustEnufFitness,,,
0,Mikeski1969,"Your review was excellent, -Michael Thank you\ufeff",2015-10-12T05:57:56.000Z,0,vega one shake,tCOmVQVmC-M,Review: VEGA Nuritional Shake | JustEnufFitness,,,
0,AK Rudla,Great video. Have you tried Naturade? If so how is it in comparison to \nVega? I purchased Naturade in vanilla and I don't like the taste. I'm \nthinking about purchasing this brand but not sure if I should try their \nFrench vanilla or another flavor. I don't want to waste another $40 and end \nup not liking it lol\ufeff,2015-09-11T03:58:36.000Z,0,vega one shake,tCOmVQVmC-M,Review: VEGA Nuritional Shake | JustEnufFitness,,,
0,kosakira,vegaone is vegan\ufeff,2015-08-25T16:02:51.000Z,0,vega one shake,tCOmVQVmC-M,Review: VEGA Nuritional Shake | JustEnufFitness,,,
0,Kimberly Fma,Can this be used as a protein shake after working out ?\nthanks  for the share :)\ufeff,2015-07-07T02:57:00.000Z,0,vega one shake,tCOmVQVmC-M,Review: VEGA Nuritional Shake | JustEnufFitness,,,
0,Atom Ant,"I was looking for a more recently posted review of this product.,and thus \nfound you.\n\nSeeing your review I think I shall give this a try.\n\nThank you.\ufeff",2015-06-17T08:07:27.000Z,0,vega one shake,tCOmVQVmC-M,Review: VEGA Nuritional Shake | JustEnufFitness,,,
0,Annel Ochoa,Where did u purchase yours and how much was it! ?\ufeff,2016-09-14T19:45:52.000Z,0,vega one shake,t1fsBsqVnJg,Vega One All in One Nutritional Shake Review with Kayla : Lucky Pick,,,
0,Annel Ochoa,Is this good for weight loss?\ufeff,2016-09-11T21:35:36.000Z,0,vega one shake,t1fsBsqVnJg,Vega One All in One Nutritional Shake Review with Kayla : Lucky Pick,,,
0,Susan Gerry,can you please post the pumpkin cookie recipe \U0001f31d\ufeff,2016-07-03T12:58:26.000Z,0,vega one shake,t1fsBsqVnJg,Vega One All in One Nutritional Shake Review with Kayla : Lucky Pick,,,
0,Heather S,"What are your thoughts on the ""natural flavor"" ingredient? I've heard lots \nof nasty chemicals and things can be hidden in natural flavors\ufeff",2016-04-19T14:47:22.000Z,0,vega one shake,t1fsBsqVnJg,Vega One All in One Nutritional Shake Review with Kayla : Lucky Pick,,,
0,Hanna Cortez,How many servings ? Is the chocolate any good?\ufeff,2016-07-17T20:44:10.000Z,0,vega one shake,FL81w7bohww,Vega One Review - All in One Nutritional Shake Reviewed,,,
0,Lexus Fox,"Can someone explain to me how and when I should drink it?\nBefore workout, mid workout, after workout?\ufeff",2016-01-30T01:55:16.000Z,0,vega one shake,FL81w7bohww,Vega One Review - All in One Nutritional Shake Reviewed,,,
0,Bobby Kanaki,Best real reaction ever... \n\nGreat vid\ufeff,2015-01-31T01:47:38.000Z,0,vega one shake,FL81w7bohww,Vega One Review - All in One Nutritional Shake Reviewed,,,
0,twopax17,what can one use instead of coffee or espresso and still get the same mocha \nflavor?\ufeff,2016-03-09T17:31:50.000Z,0,vega one shake,mNtYxzbikWk,Vegan Chocolate Frappuccino w/ VEGA One protein with Special Guest Peggy K!,,,
0,Veronique Daoust,Um yum!! Perfect for a sunny day like today! :)\ufeff,2015-05-13T18:34:18.000Z,0,vega one shake,mNtYxzbikWk,Vegan Chocolate Frappuccino w/ VEGA One protein with Special Guest Peggy K!,,,
0,Karen Delaney,That looks so delicious!  Must try\ufeff,2015-05-13T18:21:18.000Z,0,vega one shake,mNtYxzbikWk,Vegan Chocolate Frappuccino w/ VEGA One protein with Special Guest Peggy K!,,,
0,Mary Anne Calora,Need!\ufeff,2015-05-13T17:41:26.000Z,0,vega one shake,mNtYxzbikWk,Vegan Chocolate Frappuccino w/ VEGA One protein with Special Guest Peggy K!,,,
0,Fin Raziel,This looks good. I've never tried VEGA before so this might be a good \nrecipe to try with one of their samples.\ufeff,2015-05-13T10:17:25.000Z,0,vega one shake,mNtYxzbikWk,Vegan Chocolate Frappuccino w/ VEGA One protein with Special Guest Peggy K!,,,
0,Erika Chilton,"Thank you for the informative video, I'm going to definitely be trying this \nrecipe out!\ufeff",2015-05-13T03:08:25.000Z,0,vega one shake,mNtYxzbikWk,Vegan Chocolate Frappuccino w/ VEGA One protein with Special Guest Peggy K!,,,
0,norriskvt,Looks delicious! I love adding protein powder to my smoothies as a quick \nway to to boost the nutrients. \ufeff,2015-05-13T03:06:22.000Z,0,vega one shake,mNtYxzbikWk,Vegan Chocolate Frappuccino w/ VEGA One protein with Special Guest Peggy K!,,,
0,Tamera Warner,Omg that looks so freaking good cant wait to test that out....yummmy\ufeff,2015-05-12T21:43:46.000Z,1,vega one shake,mNtYxzbikWk,Vegan Chocolate Frappuccino w/ VEGA One protein with Special Guest Peggy K!,,,
0,Melissa Russell,Want!\ufeff,2015-05-12T19:39:32.000Z,1,vega one shake,mNtYxzbikWk,Vegan Chocolate Frappuccino w/ VEGA One protein with Special Guest Peggy K!,,,
0,Rhonda Miller,..looks very interesting!\ufeff,2015-05-12T19:03:33.000Z,1,vega one shake,mNtYxzbikWk,Vegan Chocolate Frappuccino w/ VEGA One protein with Special Guest Peggy K!,,,
0,jaymeeification,Does the Vega chocolate really taste like chocolate?\ufeff,2014-07-09T23:53:27.000Z,0,vega one shake,mNtYxzbikWk,Vegan Chocolate Frappuccino w/ VEGA One protein with Special Guest Peggy K!,,,
0,A Girl And her Glock,I make better quality videos with my iPhone and a $9 mini tripod.\ufeff,2016-04-17T02:11:20.000Z,0,vega one shake,23XDkYDVN_A,How to Make a Soothing Vega One Smoothie.,,,
0,remedyfarm,Yum:)\ufeff,2013-05-30T22:29:41.000Z,0,vega one shake,23XDkYDVN_A,How to Make a Soothing Vega One Smoothie.,,,
0,coolhand6656,"holy, crappy video too! crops her head out and can't keep focus. \ufeff",2012-10-21T23:12:59.000Z,1,vega one shake,23XDkYDVN_A,How to Make a Soothing Vega One Smoothie.,,,
0,Guy Gal,holy crappy audio \ufeff,2012-05-01T21:53:42.000Z,0,vega one shake,23XDkYDVN_A,How to Make a Soothing Vega One Smoothie.,,,
0,AuroraSky14,Do review on this product once you've already tried them out :)\ufeff,2016-06-27T22:58:24.000Z,1,eas advantedge,QCBcBsDSbtk,Is EAS AdvantEDGE Protein Shake Safe?,,,
0,Kristen O'Donnell,I just bought vanilla after watching this!\ufeff,2015-05-25T02:47:31.000Z,1,eas advantedge,Mh2kFemjFD4,Review: EAS AdvantEDGE Carb Control Protein Shake!,,,
0,tammymarykay1,Thanks for the review joanne I've been watching you and I'm proud of you \nyou're doing great!\ufeff,2014-04-25T14:09:15.000Z,0,eas advantedge,Mh2kFemjFD4,Review: EAS AdvantEDGE Carb Control Protein Shake!,,,
0,MsBeautifulalicia,I love those they have a really good caramel one I think they sell at \ntarget \ufeff,2014-04-25T09:29:46.000Z,0,eas advantedge,Mh2kFemjFD4,Review: EAS AdvantEDGE Carb Control Protein Shake!,,,
0,Igor Prudnik,Good day! I'm Daniel.I did -35 lbs in 30 days.Open hddiet.gs\\#3RD5 \ufeff,2013-07-04T03:03:12.000Z,0,optim metabolic shake,8o1NksF-N_4,FAQ 07: Metabolic Balance \xae - Are there any pills/shakes or special foods involved?,,,
0,Stacey Price,I would love to have a sample of this if your offer is still available.\ufeff,2015-02-23T18:17:59.000Z,0,ViSalus shakes,o3dIoHCSpm8,Visalus Shakes: What You Need To Know,,,
0,Chase Davis,I want a sample\ufeff,2014-07-15T02:53:24.000Z,0,ViSalus shakes,o3dIoHCSpm8,Visalus Shakes: What You Need To Know,,,
0,Ericka Makenzie,How can I get a Sample?\ufeff,2014-02-11T07:55:56.000Z,0,ViSalus shakes,o3dIoHCSpm8,Visalus Shakes: What You Need To Know,,,
0,GoldMedia Tour Jamaica and Feel irie,I want a sample 18764902440\ufeff,2013-10-15T22:10:32.000Z,0,ViSalus shakes,o3dIoHCSpm8,Visalus Shakes: What You Need To Know,,,
0,Muna Khurshid,"Hey Jazzabell, if you would like some info and a sample. I'd be happy to \nhelp you out. You can send me an email or give me a call. 6197812008 \nmunakhurshid@icloud.com\ufeff",2013-10-09T06:13:59.000Z,0,ViSalus shakes,o3dIoHCSpm8,Visalus Shakes: What You Need To Know,,,
0,Tomster,"if you guys require to get ripped quick without spending a single extra \nminute in the gym, then you must keep an eye on this video tutorial \nSIXPP.COM There are few sources of energy so powerful as a procrastinating \ncollege student.\ufeff",2013-10-05T19:02:27.000Z,0,ViSalus shakes,o3dIoHCSpm8,Visalus Shakes: What You Need To Know,,,
0,You2bear4eva,"Thank You !! Finally I found someone who could explain to me how much of \nthis of that, also that the scoop is inside. Just excellent !! \ufeff",2013-07-17T08:25:21.000Z,0,ViSalus shakes,o3dIoHCSpm8,Visalus Shakes: What You Need To Know,,,
0,visalus247,Jesslyn please do not do these shakes. check out my post at tracymatthewman \n. com / vi\ufeff,2013-07-12T17:09:14.000Z,0,ViSalus shakes,o3dIoHCSpm8,Visalus Shakes: What You Need To Know,,,
0,visalus247,Twila please do not take these shakes...please check out this post \ntracymatthewman . com / vi\ufeff,2013-07-12T17:08:53.000Z,0,ViSalus shakes,o3dIoHCSpm8,Visalus Shakes: What You Need To Know,,,
0,visalus247,Stay away from these shakes... check out this post tracymatthewman . com / \nvi\ufeff,2013-07-12T17:08:28.000Z,0,ViSalus shakes,o3dIoHCSpm8,Visalus Shakes: What You Need To Know,,,
0,visalus247,Liam ...I agree..I finally realized that after 22 months and some crappy \neyesight problems.\ufeff,2013-07-12T17:07:56.000Z,0,ViSalus shakes,o3dIoHCSpm8,Visalus Shakes: What You Need To Know,,,
0,visalus247,Seriously some hatred or anger going on in your heart girl. Sending you \nlove.\ufeff,2013-07-12T17:07:34.000Z,0,ViSalus shakes,o3dIoHCSpm8,Visalus Shakes: What You Need To Know,,,
0,Suzan Ibrahim,"I have a talent on face expressions and I can tell you are a lier, who is \njust looking for a black BMW\ufeff",2013-07-12T02:18:55.000Z,0,ViSalus shakes,o3dIoHCSpm8,Visalus Shakes: What You Need To Know,,,
0,Liam O'Hagan,Those shakes are full of shit.\ufeff,2013-07-10T14:36:06.000Z,0,ViSalus shakes,o3dIoHCSpm8,Visalus Shakes: What You Need To Know,,,
0,jazzabell Hart,Hi i would really like a sample can i have one please? \nseth2001@hotmail.co.uk\ufeff,2013-07-10T11:46:58.000Z,0,ViSalus shakes,o3dIoHCSpm8,Visalus Shakes: What You Need To Know,,,
0,Twila Guy,Hi!!! Trying to see how can I get a sample? If you can send it I would like \nvanilla or strawberry if you have those flavors. Let me know and I will \nsend you my address. thx\ufeff,2013-07-06T04:02:31.000Z,0,ViSalus shakes,o3dIoHCSpm8,Visalus Shakes: What You Need To Know,,,
0,Wellnessaires LisaLisa,Brilliant thanks! \ufeff,2013-06-27T19:23:16.000Z,0,ViSalus shakes,o3dIoHCSpm8,Visalus Shakes: What You Need To Know,,,
0,Delilah Hani,LOOK ON MY PAGE TO SEE HOW TO BECME A VISALUS PROMOTER\ufeff,2013-05-01T23:11:47.000Z,0,ViSalus shakes,o3dIoHCSpm8,Visalus Shakes: What You Need To Know,,,
0,Shun Sheng,Have you seen Fat Blast Factor? (Go google it) It is a quick and easy way \nto burn fat fast.\ufeff,2013-03-16T14:40:16.000Z,0,ViSalus shakes,o3dIoHCSpm8,Visalus Shakes: What You Need To Know,,,
0,Ken Esterline,yes I am :) \ufeff,2013-03-09T02:12:47.000Z,0,ViSalus shakes,o3dIoHCSpm8,Visalus Shakes: What You Need To Know,,,
0,Latasha Davis,Keep us posted girlie :-) \ufeff,2013-03-14T06:26:44.000Z,0,ViSalus shakes,TBHe1nC_pwU,30 Day Shred/Visalus shakes Challenge,,,
0,Diane L B,Good luck on your 30-day journey! I am anxious to see your results! Will \nstay tuned :o)\ufeff,2013-02-18T16:56:53.000Z,0,ViSalus shakes,TBHe1nC_pwU,30 Day Shred/Visalus shakes Challenge,,,
0,butterfy ish,TRY MEDIFAST IS THE BEST SHAKES EVER I AND EASY TO FALLOW\ufeff,2016-09-02T15:51:06.000Z,0,ViSalus shakes,TZDZGNI_xBg,The truth about Shakeology and Visalus Shakes,,,
0,namunoo,"thank you! U made so much sense to me, n U nailed right at whr I got \ntricked into!\ufeff",2016-01-16T04:45:11.000Z,0,ViSalus shakes,TZDZGNI_xBg,The truth about Shakeology and Visalus Shakes,,,
0,Sharrief Mcgee,Thank you for your honesty. I needed that this morning !!!! I want to see \nquick results thats why I was looking for a meal replacement shake.  But I \nreally need long term results and thats lifestyle change and discipline.  \nAgain thanks for the encouraging me!!\ufeff,2015-04-01T14:38:55.000Z,0,ViSalus shakes,TZDZGNI_xBg,The truth about Shakeology and Visalus Shakes,,,
0,Chris Heap Senhouse,"I don't know anything about Visalus, but Beachbody doesn't ever recommend \npeople take 2-3 Shakeology servings a day. Everything I've ever seen from \nthem starts with recommending eating healthy, whole foods. For me the \ncraving part seems to be helped by Shakeology. I don't want to eat \nchocolate or sweets, which is normally one of my weaknesses.\ufeff",2014-06-26T20:24:13.000Z,0,ViSalus shakes,TZDZGNI_xBg,The truth about Shakeology and Visalus Shakes,,,
0,Eztrainer,Thank you for your honesty however I did not hear any REAL comparison.\ufeff,2014-06-12T13:06:40.000Z,0,ViSalus shakes,TZDZGNI_xBg,The truth about Shakeology and Visalus Shakes,,,
0,Kristi A. Jones,"VERY helpful and presented in an honest and very sincere way!  Thanks for \nthe info.  I have some Shakeology which I really like, but I use it for a \nperiodic evening dessert, rather than eating processed carbs, etc. Again, \nthanks!\ufeff",2014-01-24T18:19:38.000Z,0,ViSalus shakes,TZDZGNI_xBg,The truth about Shakeology and Visalus Shakes,,,
0,Daphne Palka,"Thanks very much  for your tips. My daughter is 22 years old, and is having \na double jaw surgery in two month. She will need to be on a liquid diet for \n6-12 weeks and since i will be helping her with the diet preparations, I am \nlooking for a good protein supplement for her.She is looking to maintain \nher weight(110 pounds) rather than losing weight which is expected when one \nis on a liquid diet. Can you recommend an equivalent protein supplement \nrather than going to the expense of buying these expensive shakes? . \nThanks.\ufeff",2013-12-08T11:19:26.000Z,0,ViSalus shakes,TZDZGNI_xBg,The truth about Shakeology and Visalus Shakes,,,
0,Hafsa Khalif,"Thank you sooo much, its very helpful THANKS\ufeff",2013-09-22T17:45:49.000Z,0,ViSalus shakes,TZDZGNI_xBg,The truth about Shakeology and Visalus Shakes,,,
0,marinebetty81,"You know, I just bought some like four hours ago...a little late, I wish I \nwoulda researched a little bit more... my dad always kept heathly by food \nand vitamins, I always did too, I shoulda just stuck to that. I just wanted \nto see faster results bit I shoulda stuck to what has always worked. Thanks \nfor the video\ufeff",2013-08-16T07:29:56.000Z,0,ViSalus shakes,TZDZGNI_xBg,The truth about Shakeology and Visalus Shakes,,,
0,Candice Ziebart,very helpful video! I think you just saved me 140 bucks :)\ufeff,2013-06-29T06:32:45.000Z,0,ViSalus shakes,TZDZGNI_xBg,The truth about Shakeology and Visalus Shakes,,,
