index,author,comment_text,comment_timestamp,likes,query,video_id,video_title,,,
0,John Truesdell,"I started a Vegan meal replacement shake I bought because it was on a \nkiller sale. Got pretty good results alongside doing a program my gf got. \nWhen I finally signed up with Shakeology, I noticed that the cravings for \nsugar and fats subsided. I feel more rejuvenated after my workouts than I \ndid before starting Shakeology!\ufeff",2015-10-19T09:08:08.000Z,1,shakeology,0Pp6g2u5eJw,Shakeology Review - As if the PRICE Didn't Shock Me at First!,,,
0,Joshua wright,I won an Xbox One 2 years ago from a medium fries during Christmas. Whoo!\ufeff,2015-10-15T03:42:48.000Z,3,shakeology,0Pp6g2u5eJw,Shakeology Review - As if the PRICE Didn't Shock Me at First!,,,
0,Susan Harper,"I am loving my mocha shakeology \u2014 1/2 scoop chocolate shako, 1/2 scoop of \nthe latte, 1 cup almond milk, ice to preference and blend. Just the right \nabout of coffee flavor (the latte straight up is a bit too much coffee \nflavor, for me). This makes a creamy smoothie ... add and hard boiled egg \non the side and that's lunch.\ufeff",2016-11-02T22:06:22.000Z,0,shakeology,37ob03RElgs,How to Make Healthy Chocolate Mocha Shake\u2014Shakeology Recipe | Autumn Fitness,,,
0,Chad willingham,I have tried chocolate Shakeology with a yellow of canned black beans and \nTabasco and cinnamon to taste. It had a nice Mexican chocolate flavor\ufeff,2016-08-23T03:20:58.000Z,0,shakeology,37ob03RElgs,How to Make Healthy Chocolate Mocha Shake\u2014Shakeology Recipe | Autumn Fitness,,,
0,KW Gary,"I made a Shakeology ""Creamsicle"". Vanilla Shakeology, orange juice and a \nfrozen banana. Nutritious and delicious.\ufeff",2016-07-24T01:25:57.000Z,1,shakeology,37ob03RElgs,How to Make Healthy Chocolate Mocha Shake\u2014Shakeology Recipe | Autumn Fitness,,,
0,Mariska Mari,you van also use cacao powder with natural egwhite powder\ufeff,2016-05-31T21:17:37.000Z,0,shakeology,37ob03RElgs,How to Make Healthy Chocolate Mocha Shake\u2014Shakeology Recipe | Autumn Fitness,,,
0,carmen vc,so shakeokogy substitute only the red conteiner and can I eat de rest of \nfood on my otera conteiners or substitute all co gainers for o e meal sorry \nI'm confused.\ufeff,2016-04-09T20:00:20.000Z,0,shakeology,37ob03RElgs,How to Make Healthy Chocolate Mocha Shake\u2014Shakeology Recipe | Autumn Fitness,,,
0,richie jimenez,Can u drink it withouy blender? Like not as a frosty smoothie?\ufeff,2016-03-10T17:46:31.000Z,1,shakeology,37ob03RElgs,How to Make Healthy Chocolate Mocha Shake\u2014Shakeology Recipe | Autumn Fitness,,,
0,AJFA25,I make my shakeology with skim milk-1 serving shakeology-1teaspoon cocoa \npowder-1tablespoon of natural peanut butter. OMG soooo delicious creamy and \nchocolatey yummy\ufeff,2016-02-27T07:12:52.000Z,0,shakeology,37ob03RElgs,How to Make Healthy Chocolate Mocha Shake\u2014Shakeology Recipe | Autumn Fitness,,,
0,Ruby Zapata,can it be just regular coffee any brand???\nplease help im new on this\ufeff,2016-01-16T03:09:56.000Z,1,shakeology,37ob03RElgs,How to Make Healthy Chocolate Mocha Shake\u2014Shakeology Recipe | Autumn Fitness,,,
0,Dani Davey,"Just made this with Peppermint extract. Mmm, satisfies my craving for a \npeppermint mocha!\ufeff",2016-01-07T15:51:48.000Z,5,shakeology,37ob03RElgs,How to Make Healthy Chocolate Mocha Shake\u2014Shakeology Recipe | Autumn Fitness,,,
0,Barrilete Azul,I love this! Will give it a try while I wait for cafe latte!\ufeff,2016-01-02T09:15:53.000Z,0,shakeology,37ob03RElgs,How to Make Healthy Chocolate Mocha Shake\u2014Shakeology Recipe | Autumn Fitness,,,
0,Audra Ertel,This is actually one of my favorite recipes! I love my coffee too! So good!\ufeff,2015-10-22T07:51:49.000Z,0,shakeology,37ob03RElgs,How to Make Healthy Chocolate Mocha Shake\u2014Shakeology Recipe | Autumn Fitness,,,
0,tpfastback,"My question is... I love sweet coffee. I can not stand it only barely \nsweetened. So, is the shakeology sweet enough to really make it sweetened \nfor those who like sweet coffee? Also, is it good with vanilla shakeology \ninstead of chocolate?\ufeff",2015-10-19T21:23:08.000Z,0,shakeology,37ob03RElgs,How to Make Healthy Chocolate Mocha Shake\u2014Shakeology Recipe | Autumn Fitness,,,
0,Jennifer Green-Powers,Instead of using vanilla extract could I use the pure vanilla?\ufeff,2015-10-15T19:54:13.000Z,0,shakeology,37ob03RElgs,How to Make Healthy Chocolate Mocha Shake\u2014Shakeology Recipe | Autumn Fitness,,,
0,dillasbebs622,"My favorite Shakeology recipe: Tropical Strawberry Lemonade. 1 scoop of \nTropical Strawberry Shakeology, and 12 oz of Lemon Juice. Delicious.\n\nThen again, you'll probably think it's too sour. I'm one of those people \nwho doesn't think there is such thing as too sour.\ufeff",2015-07-27T19:41:09.000Z,1,shakeology,37ob03RElgs,How to Make Healthy Chocolate Mocha Shake\u2014Shakeology Recipe | Autumn Fitness,,,
0,KittyCatTV,"Vanilla shakeology, with finely grated carrots a couple sprinkles of \ncinnamon and you have a carrot cake! \ufeff",2015-07-10T08:00:23.000Z,2,shakeology,37ob03RElgs,How to Make Healthy Chocolate Mocha Shake\u2014Shakeology Recipe | Autumn Fitness,,,
0,gabe miller,1 cup of shakeology 2 cups of milk 1 teaspoon of peanut butter 5 cubes of \nice \ufeff,2015-01-17T19:59:00.000Z,0,shakeology,37ob03RElgs,How to Make Healthy Chocolate Mocha Shake\u2014Shakeology Recipe | Autumn Fitness,,,
0,netmstr9,"I made a mocha banana shake, using 1/2 scoop chocolate shakeology, 1 cup \ncoffee, 1 cup ice and blend. I count the banana as 1 purple, and the shake \nas 1 red. This works good for me, since I can make another shake later with \nthe other 1/2 scoop of shakeology.\ufeff",2015-01-04T12:43:53.000Z,0,shakeology,37ob03RElgs,How to Make Healthy Chocolate Mocha Shake\u2014Shakeology Recipe | Autumn Fitness,,,
0,Katerina Lopez,Does the chocolate shakeology honestly taste good? I've tried a few \nchocolate shakes and I don't seem to be very fond of them. I'm looking for \na good one.\ufeff,2014-12-30T02:47:38.000Z,0,shakeology,37ob03RElgs,How to Make Healthy Chocolate Mocha Shake\u2014Shakeology Recipe | Autumn Fitness,,,
0,tiffanys221122,You should make coffee ice cubes! ;) \ufeff,2014-11-25T22:29:17.000Z,4,shakeology,37ob03RElgs,How to Make Healthy Chocolate Mocha Shake\u2014Shakeology Recipe | Autumn Fitness,,,
0,jeffrx,"Make your smoothies from scratch, it's much better for you than this \nprocessed crap.\ufeff",2016-10-24T15:53:39.000Z,0,shakeology,j8-tSEynkxQ,Shakeology Review - Watch Before You Buy Shakeology Shake,,,
0,Hollie W,Who the hell can afford this.. its like a dam car payment! just eat \nhealthy!\ufeff,2016-10-23T03:39:53.000Z,0,shakeology,j8-tSEynkxQ,Shakeology Review - Watch Before You Buy Shakeology Shake,,,
0,Sondra Wyrick,o wow that's very expensive for better heath.... do u guys take foodstamps? \nlol \U0001f602 jk\ufeff,2016-10-12T18:57:01.000Z,1,shakeology,j8-tSEynkxQ,Shakeology Review - Watch Before You Buy Shakeology Shake,,,
0,baysideful,"ARTIFICAL SWEETNERS, GMO'S, NOT GLUTEN FREE, .....A CUP OF YOGURT HAS AS \nMUCH PROTEIN.....FIBER CAN BE FOUND IN FRUIT & VEGGIES ...TAKE A DAILY \nVITAMIN.....THIS SHAKE IS A RIP OFF ......JUST EAT CLEAN ....THE 100 \nDOCTORS ARE NOT PUTTING THIER NAME ON THIS PRODUCT ......U can make u're \nown with Almond Milk, peanut butter, a banana & fruit ......lift if u want \nmore muscle.......shakeology is a RIP OFF FAKE SWEETENERS WHICH CAUSE \nCANCER !!\ufeff",2016-09-13T23:04:09.000Z,2,shakeology,j8-tSEynkxQ,Shakeology Review - Watch Before You Buy Shakeology Shake,,,
0,Elouise Vanhelsing,"Eat healthy food, stay off the bread and pasta, exercise 30 minutes a day, \nand skip this crap. It tastes like chocolate sawdust and is made of \nbasically rice and peas with trace amounts of healthy stuff in \nsuper-minuscule quantities. Worthless garbage that is nothing more than a \nmulti-level marketing scam directed at middle age women, 80% of which will \ngive up in less than 3 weeks. Get the disks at Goodwill as they are dumped \nthere constantly, and eat like like I said above. The shakes have NO REAL \nHEALTH VALUE.\ufeff",2016-09-06T21:53:31.000Z,3,shakeology,j8-tSEynkxQ,Shakeology Review - Watch Before You Buy Shakeology Shake,,,
0,Z Mills,2:30 is the only thing you need not this\ufeff,2016-05-07T19:52:00.000Z,0,shakeology,j8-tSEynkxQ,Shakeology Review - Watch Before You Buy Shakeology Shake,,,
0,GialloHorror,This shit is TRASH! Stop selling this as if it's a meal replacement! 150 \ncalories is not a meal replacement\ufeff,2016-03-28T15:41:01.000Z,2,shakeology,j8-tSEynkxQ,Shakeology Review - Watch Before You Buy Shakeology Shake,,,
0,Robert Bannasch,Do you add water or milk to your chocolate shakeology?\ufeff,2016-03-10T22:33:10.000Z,0,shakeology,j8-tSEynkxQ,Shakeology Review - Watch Before You Buy Shakeology Shake,,,
0,Andy \u201co Guerrero x\u201d Medina,Can I drink it for breakfast?\ufeff,2016-02-22T20:34:34.000Z,0,shakeology,j8-tSEynkxQ,Shakeology Review - Watch Before You Buy Shakeology Shake,,,
0,loveonfire,Yeah shakeology is rediculous. when you cancel they WON'T STOP sending you \nand billing you the product. they also don't pay for the shipping. I've \nsent back 4 orders already.\ufeff,2016-01-23T18:28:46.000Z,2,shakeology,j8-tSEynkxQ,Shakeology Review - Watch Before You Buy Shakeology Shake,,,
0,Alix Martinez,"Thanks for the video. Try Yevo shakes. Great for weight loss with cardio. \nThere you can find a comparison chart for shakes also.. Best on the market \nright now. Here is the link, www.facebook.com/my43nutrients Good luck and \nlet me know if I can help, we offer online coaching. Blessings\ufeff",2015-12-10T05:17:42.000Z,0,shakeology,j8-tSEynkxQ,Shakeology Review - Watch Before You Buy Shakeology Shake,,,
0,stfu donny,do you even lift?\ufeff,2015-10-16T20:09:04.000Z,0,shakeology,j8-tSEynkxQ,Shakeology Review - Watch Before You Buy Shakeology Shake,,,
0,SpartanFit!,"ive been doing shakeology for a few months, i no longer am taking \nmedication for fibromyalgia.\ufeff",2015-07-17T19:47:10.000Z,5,shakeology,j8-tSEynkxQ,Shakeology Review - Watch Before You Buy Shakeology Shake,,,
0,Miguel Itriago,"So many comments saying it works and some saying it's a scam. Others saying \n""ugh"" just another coach"". First of all, a beachbody coach is someone who's \nused beachbody products and because they get results using their products \nthey share what they're doing with people who they think can benefit from \nit. That's all they are. Now there is a business opportunity and there are \nsome people who treat it like a pure sales business but the truth is it's \njust people sharing what worked for them. As for shakeology, the shake for \nme i've felt a difference one month using it and one month without it. \nHOWEVER it's up to the buyer if they want to get the shake or not. If you \ndo a workout program you don't need the shake to get results but it can add \nto your results if you take it. The price may seem a little high but it \nbalances out to about $4-5 per serving. If you can replicate the \ningredients in the shake great! There is no single path to following a \nhealthy lifestyle there are simply different ways to get different results. \nif some of you think it's a scam. If you believe you can create a different \nshake or suppliment that can help others at a cheaper price then do it! \nit's about helping people lead healthier fulfilling lives. It shouldn't be \na competition with ""hey what I do is better than what you do"" If you don't \nwant the shake don't get it. If you do want to try it my advice is to go by \nyour opinion with how you feel it has a bottom of the bag money back \nguarantee meaning if you take the entire month of shakeology and still \ndon't like it mail it back! no problem but don't attack and label EVERY \nBeachbody coach as some sort of scamming, selfish salesman because there \nare people who've gotten great results through Beachbody and want to share \nthe secret of their success with those who struggle with the same \nsituations they've recovered from. If you believe you can create something \nmore then do it. It shouldn't be a ""i'm right you're wrong debate"" it \nshould be for the people.\ufeff",2015-05-26T21:42:54.000Z,5,shakeology,j8-tSEynkxQ,Shakeology Review - Watch Before You Buy Shakeology Shake,,,
0,Kristen O'Donnell,cool!\ufeff,2015-05-25T04:56:58.000Z,0,shakeology,j8-tSEynkxQ,Shakeology Review - Watch Before You Buy Shakeology Shake,,,
0,visionofsexxy,I tired it for a few months and take it from me it taste like \nDIRT!....period\ufeff,2015-04-26T03:59:43.000Z,3,shakeology,j8-tSEynkxQ,Shakeology Review - Watch Before You Buy Shakeology Shake,,,
0,Caisa Mu\xf1oz K\xf6hlin,Jesus Christ this is bullshit\ufeff,2015-03-15T16:29:55.000Z,2,shakeology,j8-tSEynkxQ,Shakeology Review - Watch Before You Buy Shakeology Shake,,,
0,Silvana Aparicio,IS this stuff much different from herba life? was thinking about trying \nthat stuff but like just got this from a relative..so thinking about going \non........this maybe....\ufeff,2015-01-28T23:19:46.000Z,0,shakeology,j8-tSEynkxQ,Shakeology Review - Watch Before You Buy Shakeology Shake,,,
0,2600los,What website do you order it from \ufeff,2015-01-20T21:36:36.000Z,1,shakeology,j8-tSEynkxQ,Shakeology Review - Watch Before You Buy Shakeology Shake,,,
0,gabe miller,dont try the green berry its terrible \ufeff,2015-01-17T19:53:37.000Z,0,shakeology,j8-tSEynkxQ,Shakeology Review - Watch Before You Buy Shakeology Shake,,,
0,Paul L. Rogers,This should be updated. Acai is no longer used i Shakeology. However it is \nstill a great product. I use it everyday!\ufeff,2016-09-26T18:00:34.000Z,0,shakeology,me15POjiEnE,How Healthy Is Your Shake? | Shakeology,,,
0,Sara Michaels,"This stuff is amazing. After having some health problems I needed a \nsuperfood shake... I was ordering my ingredients from local stores, organic \nherb wholesalers online... and I was spending OVER $400 EACH MONTH for a \nshake that 1.) didn't even have 1/3 the ingredients 2.) took me nearly 30 \nminutes to make EACH DAY and 3.) TASTED LIKE CRAP!!! it was so bitter and \ndisgusting!!! ..... Initially I was comparing Shakeology to all that I knew \n(which was regular protein / weight loss shakes) ... but when I realized \nwhat it ACTUALLY was .... there was NO COMPARISON!!! I LOVE IT! Cafe Latte \nis my current crush!\ufeff",2016-07-09T16:34:16.000Z,0,shakeology,me15POjiEnE,How Healthy Is Your Shake? | Shakeology,,,
0,Sharon Nernberg,Why so expensive That`s unreal Not everyone can afford that\ufeff,2016-04-15T23:54:22.000Z,0,shakeology,me15POjiEnE,How Healthy Is Your Shake? | Shakeology,,,
0,Asian \u201cThe Asian Goddess\u201d Goddess,its best to have this with water / or ice cubes - almond milk. you can gain \nweight with using other fatty milk.\ufeff,2016-01-29T05:04:31.000Z,0,shakeology,me15POjiEnE,How Healthy Is Your Shake? | Shakeology,,,
0,Nick P,"I can't drink Stevia, it gives me horrible migraines. I really hope they \nmake a shake without it one day\ufeff",2016-01-17T01:22:37.000Z,0,shakeology,me15POjiEnE,How Healthy Is Your Shake? | Shakeology,,,
0,Lisa Woodrum,"I looked at other shakes, and nothing compared to Shakeology! I still have \nit every day. It is not just a weight loss tool, it is a health shake for \nlife. About 160 calories, it is a supplement, not just a meal replacement!\ufeff",2015-06-25T01:42:45.000Z,1,shakeology,me15POjiEnE,How Healthy Is Your Shake? | Shakeology,,,
0,Cynthia \u201cMickey\u201d Angel,"I for one been drinking shakeo for 6 months straight and my hair has grown \nsoooo long, and that never happened. My energy levels are great after \ndrinking a shake after a workout. I love this shake!\ufeff",2015-05-25T17:27:04.000Z,0,shakeology,me15POjiEnE,How Healthy Is Your Shake? | Shakeology,,,
0,The Venus Factor Review,Nice video...looks like a healthy meal alternative\ufeff,2014-11-18T03:58:40.000Z,0,shakeology,me15POjiEnE,How Healthy Is Your Shake? | Shakeology,,,
0,Danah Veitenthal,"I  L <3 VE Shakeology\xae - you just have no idea how great this stuff is - \nI've been fighting diabetes for years - and guess what - it's finally under \ncontrol - I don't need to go on meds or insulin - This stuff has been \nclinically proven to lower cholesterol, lower blood pressure, lower your \nblood sugar - get you healthy - lose weight - Try this out - contact me \ntoday or head on over to www.beachbodycoach.com/danahmv - you can even add \na workout to it by choosing a challenge (combo) pack - BUT - if you just \nwant the shakes - you can even check out www.myshakeology.com/danahmv and \ntry some fabulous recipes too - one of my favs is making a cup of joe and \nadding my vanilla Shakeo to it - mmmmm - so much better than going to the \nlocal coffee shop xoxo <3\ufeff",2014-08-24T21:52:28.000Z,0,shakeology,me15POjiEnE,How Healthy Is Your Shake? | Shakeology,,,
0,Mary Schofield,Love Shakeology. Want to try visit my sight \nwww.myshakeology.com/movewithmary\ufeff,2014-04-10T21:20:52.000Z,0,shakeology,me15POjiEnE,How Healthy Is Your Shake? | Shakeology,,,
0,Mark robinson,actually tony is wrong i paid 156 for my shakeology bag\ufeff,2014-02-28T22:42:15.000Z,1,shakeology,me15POjiEnE,How Healthy Is Your Shake? | Shakeology,,,
0,MrRicardoRocco,"Hahaha ""feel better"" is not the same with actually being better. This guy \nlooks healthy? And he has a lot of makeup on. LOL\ufeff",2014-02-22T21:07:18.000Z,0,shakeology,me15POjiEnE,How Healthy Is Your Shake? | Shakeology,,,
0,StillWater,Seriously the best shake out there. I've tried them all.\ufeff,2014-02-08T17:17:23.000Z,0,shakeology,me15POjiEnE,How Healthy Is Your Shake? | Shakeology,,,
0,amy henninger,I love my shakeology. I drink it everyday and it gives me a ton of energy!\ufeff,2014-01-26T22:50:54.000Z,7,shakeology,me15POjiEnE,How Healthy Is Your Shake? | Shakeology,,,
0,Erica Kelly,I don't start my day without it! The chocolate is delicious!!!\ufeff,2014-01-25T20:59:11.000Z,2,shakeology,me15POjiEnE,How Healthy Is Your Shake? | Shakeology,,,
0,StillWater,It's the best shake around :-)\ufeff,2014-01-25T07:58:07.000Z,1,shakeology,me15POjiEnE,How Healthy Is Your Shake? | Shakeology,,,
0,Michael Crayton,Its amazing this tastes great\ufeff,2014-01-25T05:32:13.000Z,1,shakeology,me15POjiEnE,How Healthy Is Your Shake? | Shakeology,,,
0,Fernando5455,I wanna try this ! But online only:/ I wish they sell this at GNC or even a \nbeachbody store in Austin TX !!! \ufeff,2014-01-25T03:32:25.000Z,1,shakeology,me15POjiEnE,How Healthy Is Your Shake? | Shakeology,,,
0,Katsudon \u30ab\u30c4\u30c9 \u30f3,"Funny that the ""competitor"" shake is actually sun warrior protein with \nstickers all over it. Which is just a vegan protein powder and not supposed \nto be anything like shakeology. I bet it was Tony's personal protein powder \nbecause i know he uses vegan protein.\ufeff",2014-01-24T23:18:05.000Z,0,shakeology,me15POjiEnE,How Healthy Is Your Shake? | Shakeology,,,
0,Katrina Benton,"Shakeology in the long run is cheap, good for you nutrients that help you \nthru the day. here is a you tube commercial for your enjoyment. ask \nquestions and Ill try my best to answer them. Thank you and Stay Healthy.\ufeff",2016-10-11T02:45:36.000Z,0,shakeology,HwgaeGBvm4c,Shakeology Ingredients: Tony Horton Checks Out Shakeology,,,
0,Ashli Rouw,LOL he cracks me up!\ufeff,2016-08-14T23:02:45.000Z,0,shakeology,HwgaeGBvm4c,Shakeology Ingredients: Tony Horton Checks Out Shakeology,,,
0,Kadin Allan,I love the idea end if the commercial\ufeff,2016-07-08T15:51:54.000Z,2,shakeology,HwgaeGBvm4c,Shakeology Ingredients: Tony Horton Checks Out Shakeology,,,
0,2emeraldeyes,"Great commercial, but what is this the 70's? Give me the Ingredients \nplease.\ufeff",2016-04-14T09:12:34.000Z,1,shakeology,HwgaeGBvm4c,Shakeology Ingredients: Tony Horton Checks Out Shakeology,,,
0,lesrach3,Why does nobody make healthy shake for people trying to GAIN weight!?!?\ufeff,2016-04-01T21:21:28.000Z,1,shakeology,HwgaeGBvm4c,Shakeology Ingredients: Tony Horton Checks Out Shakeology,,,
0,Jennifer Squillace,"Just eat healthy, workout and take a multi vitamin if you're lacking \nsomething.\ufeff",2016-01-11T00:23:38.000Z,0,shakeology,HwgaeGBvm4c,Shakeology Ingredients: Tony Horton Checks Out Shakeology,,,
0,Nolan Thorpe,I want spicy cheetos smuthered in nacho cheese now.\ufeff,2016-01-06T02:57:30.000Z,2,shakeology,HwgaeGBvm4c,Shakeology Ingredients: Tony Horton Checks Out Shakeology,,,
0,chad wick,Who's the woman in this commercial?  I can't think of her name.\ufeff,2015-12-11T16:38:04.000Z,0,shakeology,HwgaeGBvm4c,Shakeology Ingredients: Tony Horton Checks Out Shakeology,,,
0,Tammy Manning,Order through my website so I can be your assigned COACH!! \nHttp://www.shakeology.com/Faithinfitness7\ufeff,2015-12-01T12:53:28.000Z,0,shakeology,HwgaeGBvm4c,Shakeology Ingredients: Tony Horton Checks Out Shakeology,,,
0,renato doctor,I think is expensive to pay for shakes 129 $\ufeff,2015-11-29T07:03:52.000Z,1,shakeology,HwgaeGBvm4c,Shakeology Ingredients: Tony Horton Checks Out Shakeology,,,
0,Catbug VEVO,Big fan of Tim Horton's. But why is there no donuts in this video?\ufeff,2015-08-11T18:40:26.000Z,0,shakeology,HwgaeGBvm4c,Shakeology Ingredients: Tony Horton Checks Out Shakeology,,,
0,Catbug VEVO,My father was killed by a gang of Sugar O's in Cincinnati in 1987. You \nshould be ashamed of yourselves for making light of my family's tragedy.\ufeff,2015-08-11T18:39:40.000Z,1,shakeology,HwgaeGBvm4c,Shakeology Ingredients: Tony Horton Checks Out Shakeology,,,
0,Jay Wallen,If you are interested in Shakeo check out this link:\n\nhttp://click.email.beachbody.com/?qs=1b4b986b5feefee406e6026cf384b487893cf871e07e18aeca0a4ff0ea8eb5479724a3321bd4d908\n\ufeff,2015-08-05T13:19:50.000Z,0,shakeology,HwgaeGBvm4c,Shakeology Ingredients: Tony Horton Checks Out Shakeology,,,
0,MiguelETV,my favorite flavor is vegan chocolate and it was delicious\ufeff,2015-08-02T00:23:39.000Z,1,shakeology,HwgaeGBvm4c,Shakeology Ingredients: Tony Horton Checks Out Shakeology,,,
0,Scott Common,"Too funny!  Tony's humor cracks me up.  His exercise vid's are the best - \nlight, fun and kick ARS!\ufeff",2015-07-26T05:25:25.000Z,0,shakeology,HwgaeGBvm4c,Shakeology Ingredients: Tony Horton Checks Out Shakeology,,,
0,LokiTattoo,His workout program is amazing. But he himself drives me crazy. I have to \nmute the DVD while I work out\ufeff,2015-07-02T21:26:05.000Z,2,shakeology,HwgaeGBvm4c,Shakeology Ingredients: Tony Horton Checks Out Shakeology,,,
0,SpartanFit!,If anyone is interested in joining our Beachbody group on Facebook please \ngo to : https://www.facebook.com/groups/858089004226413/\nAlso: https://www.teambeachbody.com/tbbsignup/-/tbbsignup/free/721997\ufeff,2015-06-24T14:58:52.000Z,0,shakeology,HwgaeGBvm4c,Shakeology Ingredients: Tony Horton Checks Out Shakeology,,,
0,TheBryantCabrera,"I think Tony Horton makes BeachBody for me.  His personality and face are \njust so iconic that he is more than just P90X or Shakeology to me.\n\nMy favorite benefit of Shakeology is that it helps curb my cravings.  I \nactually feel full during lunch (when I take it) and it prevents me from \nmunching on snacks.  I used to snack all the time around lunch.  \n\nMy favorite flavor is definitely Chocolate.  It just tastes way better than \nI imagined\u2014and this is coming from someone who used to eat boxes of Godiva \ntruffles every month LOL (ah, I miss making money lol).  I mix it with PB2 \nto make a Reese\u2019s flavored shake\u2014my all-time favorite combination.\n\nThe most important benefits to me are:\n1. Price: At only $4 a serving it is cheaper than eating out.  I used to \neat out A LOT as a Yelp Elite member.\n2. Curbs Cravings: I no longer get tempted to snack and go over my calorie \nlimits.  I didn\u2019t actually think Shakeology could help with that, but it \nhas.  I\u2019m not questioning it anymore haha.\n3. Palatability: The chocolate Shakeology just tastes so darn good.  I am \nnot even lying or exaggerating.  I used to review decent restaurants in \nKoreatown and Beverly Hills of Los Angeles, and can be fairly critical of \nfood.  I actually can\u2019t wait to have my Chocolate Shakeology again.\n\nwww.Shakeology.com/BryantCabrera\nwww.BeachBodyCoach.com/BryantCabrera\ufeff",2015-06-18T03:20:19.000Z,7,shakeology,HwgaeGBvm4c,Shakeology Ingredients: Tony Horton Checks Out Shakeology,,,
0,laczuszka1985,Great! I love it! :)\ufeff,2015-06-06T14:51:37.000Z,0,shakeology,HwgaeGBvm4c,Shakeology Ingredients: Tony Horton Checks Out Shakeology,,,
0,SupaHoon,"I can't believe the blatant fat shaming in this ad!! \nI totally approve, good work! :)\ufeff",2015-05-14T02:00:19.000Z,2,shakeology,HwgaeGBvm4c,Shakeology Ingredients: Tony Horton Checks Out Shakeology,,,
0,Sondra Wyrick,"lol its so expensive how r u ppl spending on this lol (only broke ppl say \nthat) lol that's expensive I'm just thinking bout saying eff all that... \nI'll go to the store buy 1 a day women's vitamins and fiber, fish oil, \nveggies, fruits, protein powder all n blender... ... n die cuz idk the \nmessaurements \U0001f602\U0001f602\U0001f602\ufeff",2016-10-12T19:08:50.000Z,0,shakeology,rF-6ap5z5rM,Review of Shakeology After 4 Weeks,,,
0,winiver77,"What does Greenberry taste like? is it sweet, sour? bitter?\ufeff",2016-07-07T21:22:03.000Z,0,shakeology,rF-6ap5z5rM,Review of Shakeology After 4 Weeks,,,
0,Patrick Romero,worth it worth it!\ufeff,2016-01-28T03:29:10.000Z,2,shakeology,rF-6ap5z5rM,Review of Shakeology After 4 Weeks,,,
0,Diamondgirl08,Thank you for this review. \u263a\ufeff,2016-01-02T05:07:30.000Z,1,shakeology,rF-6ap5z5rM,Review of Shakeology After 4 Weeks,,,
